Num.,Course Name,Hours,Gen. Ed.,Core. Curr.,Prerequisites,Description
ART 640,Sculpture Studio,1-6,,,Graduate Standing,"Technical and conceptual information about wood and stone carving and construction, welding and metal fabrication, foundry practice, emphasizing individual development.  Repeatable to a maximum of 33 hours."
ART 650,Pedagogy,3,,,Graduate Standing,"Focus of this course is the teaching practice of artistic concepts, foundations of art and subject matter of technical, historical and conceptual content in art curricula.  Students will be exposed to the many issues of conveying ideas, and motivating students to make the educational experience meaningful.  Practical issues of : teaching philosophy, resources, syllabi creation, assessment and course planning will be part of the discussion."
ART 660,Interdisciplinary  Studio,1-6,,,Graduate Standing,"Advanced work in more than one concentration.  May include two- or three-dimensional media; may incorporate installation work, performance, construction, and creative expression with interrelated forms of fine arts and design.  Repeatable to maximum of 9 hours."
ART 670,Painting Studio,1-6,,,Graduate Standing,Advanced painting in the medium and direction of the student's choice.  Emphasis on creative development and technical competence.  Repeatable to a maximum of 33 hours.
ART 680,Special Problems,1-6,,,Graduate Standing,Problems in area of students interest as advised by instructor.  Repeatable to a maximum of 18 hours.
ART 689,Design Research and Collaboration,3,,,Graduate Standing,"A design problem that responds to social, economic, and environmental concerns created in consultation and collaboration with a corporation, institution, or government agency under the supervision of the faculty.  Repeatable to a maximum of 9 hours."
ART 690,Seminar,3,,,,"Research and presentation of art topics ranging from history to contemporary concerns of the artist, to interdisciplinary courses consisting of an organized sequence of guest speakers.  May be repeated under different topics to a maximum accumulated credit of 18 hours."
ART 694,Visual Communications and Design Studio,1-6,,,Graduate Standing,"Working with hypothetical environments and data, focuses on design development, problem-solving skills, visualization and invention.  Concept, exploration emphasized while developing a personal creative vision and understanding of current graphic design practices and technology.  Repeatable to a maximum of 33 hours."
ART 695,Theory and Criticism,3-6,,,Graduate Standing,"Research, discussion and presentation on topics in fine arts and design, including contemporary trends, philosophies, literature and history. Repeatable to a maximum of 6 semester hours"
ART 696,Advanced Digital Design,3-6,,,Graduate Standing,"Advanced work in applied software for web design, animation, rapid prototyping, interactive design and experience design.  Repeatable to 9 semester hours."
ART 697,Design Management,3-6,,,Graduate Standing,"Development phases of real-world project execution, including: research, problem definition, planning, cost and budget analysis, organization,and presentation of information for business, public institutions, government and the entertainment industry.  Repeatable to 9 hours."
ART 698,Thesis Exhibition,0-3,,,Candidacy for M.A,"At the beginning of their second semester, studio art M.A. candidates must submit a proposal that defines their evolving work.  Full time M.A. candidates register for Art 698 for the third semester. At this time candidates present thesis exhibitions for review by the graduate faculty and other invited participants.  A written comprehensive exam also supplements the exhibition. Upon successful completion of all academic and exhibition requirements, students may be invited to continue toward completion of the M.F.A. requirements."
ART 699,Thesis Exhibition M.F.A.,0-3,,,M.A. and candidacy for M.F.A,"At the beginning of the second semester, M.F.A. candidates submit a proposal that defines their evolving thesis work.  During the last semester of their final year, all M.F.A. candidates will be registered for Art 699 and will present thesis exhibitions for review by graduate faculty and other invited guests.  A written comprehensive exam done in consultation with the student's graduate committee supplements the exhibition."
